Date,Name,Country,Year,Month,Day,description,image,match_movie1,match_movie1_descr,match_movie2,match_movie2_descr,match_movie3,match_movie3_descr,match_book1,match_book1_descr,match_book2,match_book2_descr,match_book3,match_book3_descr
1964-07-29 00:00:00,Lisa Peluso,,1964,7,29,birthday,,Saturday Night Fever,Tony spends his Saturdays at a disco where his stylish moves raise his popularity among the patrons. But his life outside the disco is not easy and things change when he gets attracted to Stephanie.,,,,,,,,,,
1990-07-29 00:00:00,Munro Chambers,,1990,7,29,birthday,https://upload.wikimedia.org/wikipedia/commons/thumb/a/ab/2011_MuchMusic_Video_Awards_-_Munro_Chambers.jpg/220px-2011_MuchMusic_Video_Awards_-_Munro_Chambers.jpg,Beethoven's Christmas Adventure,"A Christmas elf accidentally takes off in Santa's sleigh, crash lands in a small town, and loses the magic toy bag. Beethoven must rescue the elf, recover the bag from greedy crooks, and return the sleigh to Santa in time to save Christmas.",Riot Girls,"In an alternate 1995, a mysterious disease has wiped out all of the adults. In this new age, two gangs are pitted against each other in a brutal war for territory, resources and survival. ​",The Retreat,"Renee and Valerie, a couple at a cross roads in their relationship, leave the city to spend the week at a remote cabin with friends. But when they arrive, their friends are nowhere to be found. As they stumble through their relationship woes, they discover they are being hunted by a group of militant extremists who are determined to exterminate them.",,,,,,
1938-07-29 00:00:00,Walter Ackerman,,1938,7,29,birthday,,A Midsummer Night's Dream,An early film adaptation of the Beard's comic fantasy-- and perhaps the first screen adaptation of a Shakespeare play.,,,,,,,,,,
1888-07-29 00:00:00,George Chesebro,,1888,7,29,birthday,https://upload.wikimedia.org/wikipedia/commons/thumb/5/56/George_Chesebro_-_May_1919_MPW.jpg/220px-George_Chesebro_-_May_1919_MPW.jpg,It Happened in Hollywood,A silent Western star has trouble adjusting to the coming of sound.,Billy the Kid,"Billy Bonney is a hot-headed gunslinger who narrowly skirts a life of crime by being befriended and hired by a peaceful rancher, Eric Keating. When Keating is killed, Billy seeks revenge on the men who killed him, even if it means opposing his friend, Marshal Jim Sherwood.",Last of the Comanches,"It's 1876 and all the Indians are at peace except the Comanches lead by Black Cloud. When Black Cloud wipes out a town, only six soldiers are left and they head for the nearest fort. In the desert they are reinforced by members of a stagecoach and find some water at a deserted mission. Pinned down by Black Cloud they send an Indian boy who was Black Cloud's prisoner on to the fort while they try to bargain with Black Cloud whom they learn is without water.",,,,,,
1966-07-29 00:00:00,Richard Steven Horvitz,,1966,7,29,birthday,https://upload.wikimedia.org/wikipedia/commons/thumb/e/ef/Richard_Steven_Horvitz_Photo_Op_GalaxyCon_Richmond_2020.jpg/220px-Richard_Steven_Horvitz_Photo_Op_GalaxyCon_Richmond_2020.jpg,The Angry Birds Movie 2,"Red, Chuck, Bomb and the rest of their feathered friends are surprised when a green pig suggests that they put aside their differences and unite to fight a common threat. Aggressive birds from an island covered in ice are planning to use an elaborate weapon to destroy the fowl and swine.",The Informant!,"A rising star at agri-industry giant Archer Daniels Midland (ADM), Mark Whitacre suddenly turns whistleblower. Even as he exposes his company’s multi-national price-fixing conspiracy to the FBI, Whitacre envisions himself being hailed as a hero of the common man and handed a promotion.",Summer School,"A high-school gym teacher has big plans for the summer, but is forced to cancel them to teach a ""bonehead"" English class for misfit goof-off students. Fortunately, his unconventional brand of teaching fun field trips begins to connect with them, and even inspires ardor in some.",,,,,,
1962-07-29 00:00:00,Kevin Chapman,,1962,7,29,birthday,https://upload.wikimedia.org/wikipedia/commons/thumb/6/6d/Kevin_Chapman_May_2016.jpg/250px-Kevin_Chapman_May_2016.jpg,The Boondock Saints,"Tired of the crime overrunning the streets of Boston, Irish Catholic twin brothers Conner and Murphy are inspired by their faith to cleanse their hometown of evil with their own brand of zealous vigilante justice. As they hunt down and kill one notorious gangster after another, they become controversial folk heroes in the community. But Paul Smecker, an eccentric FBI agent, is fast closing in on their blood-soaked trail.",City of Lies,"Los Angeles Police Department detective Russell Poole has spent years trying to solve his biggest case -- the murders of The Notorious B.I.G. and Tupac Shakur -- but after two decades, the investigation remains open. Jack Jackson, a reporter desperate to save his reputation and career, is determined to find out why. In search of the truth, the two team up and unravel a growing web of institutional corruption and lies.",In Good Company,"Dan Foreman is a seasoned advertisement sales executive at a high-ranking publication when a corporate takeover results in him being placed under naive supervisor Carter Duryea, who is half his age. Matters are made worse when Dan's new supervisor becomes romantically involved with his daughter an 18 year-old college student Alex.",,,,,,
1910-07-29 00:00:00,Gale Page,,1910,7,29,birthday,https://upload.wikimedia.org/wikipedia/commons/thumb/c/c3/Gale_Page_in_Four_Daughters_trailer.jpg/220px-Gale_Page_in_Four_Daughters_trailer.jpg,The Time of Your Life,"Joe spends a lot of his time at Nick's Pacific Street Saloon. Tom, who credits Joe with once saving his life, stops by regularly to run errands for Joe. Today, Tom notices a woman named Kitty when she comes into Nick's, and he quickly falls in love with her. Meanwhile, a distraught young man repeatedly calls his girlfriend, begging her to marry him. Nick himself muses on all the various persons who come into his bar, some to ask for work and others just to pass the time.",They Drive by Night,"Joe and Paul Fabrini are Wildcat, or independent, truck drivers who have their own small one-truck business. The Fabrini boys constantly battle distributors, rivals and loan collectors, while trying to make a success of their transport company.",The Amazing Dr. Clitterhouse,A wealthy society doctor decides to research the medical aspects of criminal behaviour by becoming one himself. He joins a gang of thieves and proceeds to wrest leadership of the gang away from it's extremely resentful leader.,,,,,,
1983-07-29 00:00:00,Kaitlyn Black,,1983,7,29,birthday,,Driven to Dance,"While preparing to audition for a renowned ballet company, Paige must convince herself and her mother that she has what it takes to make it in the world of dance.",,,,,,,,,,
1982-07-29 00:00:00,Heidi Johanningmeier,,1982,7,29,birthday,,Unexpected,An inner-city high school teacher discovers she is pregnant at the same time as one of her most promising students and the two develop an unlikely friendship while struggling to navigate their unexpected pregnancies.,The Last Summer,"Standing on the precipice of adulthood, a group of friends navigate new relationships, while reexamining others, during their final summer before college.",100 Days to Live,"When a serial killer abducts a young woman’s fiancé, she must race against the clock to discover the identity of the killer, and more importantly – his motive.",,,,,,
1984-07-29 00:00:00,Todd Bosley,,1984,7,29,birthday,,Little Giants,"When Danny O'Shea's daughter is cut from the Peewee football team just for being a girl, he decides to form his own team, composed of other ragtag players who were also cut. Can his team really learn enough to beat the elite team, coached by his brother, a former pro player?",,,,,,,,,,
1978-07-29 00:00:00,Robert J. Steinmiller Jr.,,1978,7,29,birthday,,Jack the Bear,"Story of the relationships between two sons and their father, who moves the family to California and becomes a tv horror show host after the death of his wife.",,,,,,,,,,
1943-07-29 00:00:00,Charles Hallahan,,1943,7,29,birthday,,Nightwing,Killer bats plague an Indian reservation in Arizona.,Space Jam,"Jokes fly as the Tune Squad takes on the Nerdlucks in a hardcourt game to decide if the Looney Tunes remain here... or become attractions at a far-off galactic off-ramp called Moron Mountain. The Nerdlucks have a monstrous secret weapon: they've stolen the skills of top NBA stars like Charles Barkley and Patrick Ewing and become Monstars. But that's not all, folks. The Tune Squad’s secret weapon just happens to be the finest player in this or any other universe. He's outta this world. So's the fun.",Going in Style,"Three senior citizens in their 70s who live together are slowly decaying in endless days with nothing to do but feed the birds. One of them comes up with an idea - rob a bank. They certainly could use the money if they get away with it and if they are caught, what could happen to three old men?",,,,,,
1943-07-29 00:00:00,Jim Ishida,,1943,7,29,birthday,,The Silencers,"U.S. Senator is assassinated by Men in Black, mysterious organization which suppresses all knowledge about UFOs.  Agent Rafferty from the U.S. Secret Service will confront them and discover the sinister truth. The only person that can help him comes from another world.",Showgirls,"A young drifter named Nomi arrives in Las Vegas to become a dancer. When she catches the eye of Cristal, the main attraction at the Stardust stage show, Nomi is on the brink of realizing her dreams. But as she bumps and grinds her way to the top, she realizes that there is only room for one starlet on the marquee... and that either she or Cristal will have to take a fall!",Black Rain,"Two New York cops get involved in a gang war between members of the Yakuza, the Japanese Mafia. They arrest one of their killers and are ordered to escort him back to Japan. However, in Japan he manages to escape, and as they try to track him down, they get deeper and deeper into the Japanese Mafia scene and they have to learn that they can only win by playing the game—the Japanese way.",,,,,,
1971-07-29 00:00:00,Monica Calhoun,,1971,7,29,birthday,,Gang of Roses,"Set in the 1800's, the town of Flat ridge is over run by a band of outlaws looking for lost treasure said to be buried somewhere in town. In their quest for dominance, the outlaws kill Sally, a whore who happens to be the sister of Rachel and a 1/5 member of the Roses Gang. With the weight of grief on her heart, Rachel decides to shed her new found religious faith to bring vengeance upon her sister's killers. After placing Sally to rest, she goes in search of her former posse to assist her in the reckoning of the outlaws wrong doing.",The Best Man,"After writing a soon-to-be bestselling novel, writer and committed bachelor Harper attempts to hide the fact that his saucy new book is loosely based on the lives and loves of his tight-knit group of friends. Harper is set to be best man at his friend Lance's wedding, and all his friends will be in attendance. When an advance copy of the book makes its way into the hands of his ex-flame, Jordan, Harper attempts to keep it under wraps.",Civil Brand,"Forced to work under slave-like conditions in a ""prison for profit"" program, the inmates of a mostly-African-American female prison, Whitehead Correctional, try to take over the institution. At the core of the story is Frances, who finds herself in prison after being falsely convicted of murder, and who is told that her baby has been murdered, sparking her to lead her fellow inmates in the protest",,,,,,
1939-07-29 00:00:00,Hildegard Neil,,1939,7,29,birthday,,The Man Who Haunted Himself,"Executive Harold Pelham suffers a serious accident after which he faces the shadow of death. When, against all odds, he miraculously recovers, he discovers that his life does not belong to him anymore.",A Touch of Class,"Steve, a happily married American man living in London meets Vicki, an English divorcée and run off to Marbella for a rollicking week of sex. They then return to London to set up a cozy menage, despite the fact that he loves his wife and children, and now realize that he and Vicki have also fallen in love.",The Mirror Crack'd,Jane Marple solves the mystery when a local woman is poisoned and a visiting movie star seems to have been the intended victim.,,,,,,
1983-07-29 00:00:00,Rosa María Hernández,,1983,7,29,birthday,,Man on Fire,"Jaded ex-CIA operative John Creasy reluctantly accepts a job as the bodyguard for a 10-year-old girl in Mexico City. They clash at first, but eventually bond, and when she's kidnapped he's consumed by fury and will stop at nothing to save her life.",,,,,,,,,,
1955-07-29 00:00:00,Jean-Hugues Anglade,,1955,7,29,birthday,,Léon: The Professional,"Léon, the top hit man in New York, has earned a rep as an effective ""cleaner"". But when his next-door neighbors are wiped out by a loose-cannon DEA agent, he becomes the unwilling custodian of 12-year-old Mathilda. Before long, Mathilda's thoughts turn to revenge, and she considers following in Léon's footsteps.",,,,,,,,,,
1938-07-29 00:00:00,Enzo G. Castellari,,1938,7,29,birthday,,Inglourious Basterds,"In Nazi-occupied France during World War II, a group of Jewish-American soldiers known as ""The Basterds"" are chosen specifically to spread fear throughout the Third Reich by scalping and brutally killing Nazis. The Basterds, lead by Lt. Aldo Raine soon cross paths with a French-Jewish teenage girl who runs a movie theater in Paris which is targeted by the soldiers.",,,,,,,,,,
1919-07-29 00:00:00,Robert Fitch,,1919,7,29,birthday,,Pennies from Heaven,"During the Great Depression, a sheet music salesman seeks to escape his dreary life through popular music and a love affair with an innocent school teacher.",,,,,,,,,,
1876-07-29 00:00:00,Maria Ouspenskaya,,1876,7,29,birthday,,The Mortal Storm,"The Roth family leads a quiet life in a small village in the German Alps during the early 1930s. When the Nazis come to power, the family is divided and Martin Brietner, a family friend is caught up in the turmoil.",Tarzan and the Amazons,"A group of archaeologists asks Tarzan to help them find an ancient city in a hidden valley of women. He refuses, but Boy is tricked into doing the job. The queen of the women asks Tarzan to help them.",The Shanghai Gesture,A gambling queen uses blackmail to stop a British financier from closing her Chinese clip joint.,,,,,,
1923-07-29 00:00:00,Gordon Mitchell,,1923,7,29,birthday,,Around the World in Eighty Days,"Based on the famous book by Jules Verne the movie follows Phileas Fogg on his journey around the world. Which has to be completed within 80 days, a very short period for those days.",,,,,,,,,,
1973-07-29 00:00:00,Dileep Rao,,1973,7,29,birthday,,Inception,"Cobb, a skilled thief who commits corporate espionage by infiltrating the subconscious of his targets is offered a chance to regain his old life as payment for a task considered to be impossible: ""inception"", the implantation of another person's idea into a target's subconscious.",Murder of a Cat,"When someone murders his beloved cat, Clinton, an adult child, demands justice. Taking it upon himself to solve the case, he teams up with an unlikely ally, Greta, and the two set out to find the culprit lurking in their small suburban town. But as Clinton searches for the truth, he begins to uncover a conspiracy that goes far deeper than he anticipated.",Avatar: The Way of Water,"Set more than a decade after the events of the first film, learn the story of the Sully family (Jake, Neytiri, and their kids), the trouble that follows them, the lengths they go to keep each other safe, the battles they fight to stay alive, and the tragedies they endure.",,,,,,
1941-07-29 00:00:00,Forbes Collins,,1941,7,29,birthday,,Tess,"A strong-willed peasant girl is sent by her father to the estate of some local aristocrats to capitalize on a rumor that their families are from the same line, but is left traumatised from her experiences.",,,,,,,,,,
1957-07-29 00:00:00,Ulrich Tukur,,1957,7,29,birthday,,Earth,"From the acclaimed team that brought you BBC's visual feast ""Planet Earth,"" this feature length film incorporates some of the same footage from the series with all new scenes following three remarkable, yet sadly endangered, families of animal across the globe.",,,,,,,,,,
1916-07-29 00:00:00,Max Faulkner,,1916,7,29,birthday,,The Day of the Jackal,"An international assassin known as ‘The Jackal’ is employed by disgruntled French generals to kill President Charles de Gaulle, with a dedicated gendarme on the assassin’s trail.",Where Eagles Dare,"World War II is raging, and an American general has been captured and is being held hostage in the Schloss Adler, a Bavarian castle that's nearly impossible to breach. It's up to a group of skilled Allied soldiers to liberate the general before it's too late.",Anne of the Thousand Days,"Henry VIII of England discards his wife, Katharine of Aragon, who has failed to produce a male heir, in favor of the young and beautiful Anne Boleyn.",,,,,,
1935-07-29 00:00:00,Sharon Gans,,1935,7,29,birthday,,Slaughterhouse-Five,"Billy Pilgrim, a veteran of the Second World War, finds himself mysteriously detached from time, so that he is able to travel, without being able to help it, from the days of his childhood to those of his peculiar life on a distant planet called Tralfamadore, passing through his bitter experience as a prisoner of war in the German city of Dresden, over which looms the inevitable shadow of an unspeakable tragedy.",,,,,,,,,,
1889-07-29 00:00:00,C. Denier Warren,,1889,7,29,birthday,,The Clairvoyant,A fake psychic suddenly turns into the real thing when he meets a young beauty. (TCM),,,,,,,,,,
1935-07-29 00:00:00,Joan Gerber,,1935,7,29,birthday,,Corn on the Cop,"It's Halloween, and an elderly lady, Granny, is leaving a grocery store with her treats for the children...",DuckTales: The Movie - Treasure of the Lost Lamp,"With his nephews and niece, everyone's favorite rich uncle, Scrooge McDuck, treks from his mansion home in Duckburg in search of the long-lost loot of the thief Collie Baba. But finding the goods isn't quite what it's ""quacked"" up to be! Their thrilling adventure leads to comical chaos, magical mayhem, and a lesson about what is far more valuable than money, gold and jewels.",Shinbone Alley,"Suicidal poet Archy tries to end his life by jumping off a bridge, but awakens to find he has assumed the life of a cockroach and has become a part of a community of creatures living in a newspaper office. He also discovers that he can still write poetry, using a typewriter, and begins to enjoy his new life. Archy develops deep feelings for the lovely but self-destructive cat Mehitabel, but will have to fight to win her from bad-boy tomcat Bill.",,,,,,
1963-07-29 00:00:00,Alexandra Paul,,1963,7,29,birthday,,Rough Air: Danger on Flight 534,"Having taken the blame for an accident beyond his control, pilot Mike Hogan has been on administrative leave indefinitely; however when the airline is desperately short of staff, he is offered to be first officer and accepts, without enthusiasm, received with disdain by the well-connected commander. Surprisingly his come-back proves less then routine, as the captain gets knocked out and a collision as well as a murderer being transported by police require courageous action from Mike, his crew and several passengers, including soccer star Ty Conner.",Sharknado 4: The 4th Awakens,"The new installment of the Sharknado franchise takes place 5 years after Sharknado 3: Oh Hell No! There have been no Sharknados in the intervening years, but now they’re appearing again in unexpected ways.",The Paperboy,"A homicidal twelve-year-old paperboy becomes obsessed with a woman and her daughter next-door, and he'll do anything to make his fantasy of the ""perfect family"" come alive.",,,,,,
1952-07-29 00:00:00,Wendy Hughes,,1952,7,29,birthday,,My Brilliant Career,A young woman who is determined to maintain her independence finds herself at odds with her family who wants her to tame her wild side and get married.,Princess Caraboo,"Bristol, England, early 19th century. A beautiful young stranger who speaks a weird language is tried for the crime of begging. But when a man claims that he can translate her dialect, it is understood that the woman is a princess from a far away land. She is then welcomed by a family of haughty aristocrats that only wants to heighten their prestige. However, the local reporter is not at all convinced she is what she claims to be and investigates. Is Caraboo really a princess?",Wild Orchid II: Two Shades of Blue,"Blue is a teenage girl who lives with her Jazz playing father Ham. Ham gets very sick and dies, and now Blue must support herself somehow. Elle, the headmistress at a brothel, talks her into living and working at her establishment. She decides to leave the business and lead a normal life. Elle is hellbent to see that she never has one.",,,,,,
1982-07-29 00:00:00,Emily Neves,,1982,7,29,birthday,,Starship Troopers: Invasion,"The troopers of two starships have joined forces to terminate a massive bug attack at a Federation outpost. Before the mission can be completed and the survivors evacuated, one ship abruptly departs and goes inexplicably dark. The remaining battle-hardened troopers race to the rescue only to discover that the threat from the bugs is about to hit home.",,,,,,,,,,
1894-07-29 00:00:00,Charles C. Wilson,,1894,7,29,birthday,,The Dragon Murder Case,"Wonderful idea to give a party with people who dislike each other. Late at night, everyone decides to go into the pool, except Stamm, who is drunk. Montague dives in as does Greeff and Leland, but only Greeff and Leland come out. Montague is no where to be found so Leland suspects foul play and calls the cops. Luckily, Philo is with the D.A. and comes along, but they do not find Montague. When they drain the pool the next day, they find nothing except what looks like dragon prints. Philo has his suspicions and tries to piece the clues together to find out what has happened.",The Face Behind the Mask,"In this low-budget thriller, Peter Lorre plays Janos Szabo, an immigrant from Hungary who is a skilled craftsman. After he's caught in a fire, his face is horribly scarred; his terrifying appearance makes it impossible for him to get a job. With nowhere else to turn, Janos begins working for the criminal underworld. Janos begins having second thoughts about his life of crime when he falls in love.",Dressed to Kill,A detective's wedding is postponed when gunshots are heard nearby.,,,,,,
1991-07-29 00:00:00,Maestro Harrell,,1991,7,29,birthday,,Thriller,"Years after a childhood prank goes horribly wrong, a clique of South Central LA teens find themselves terrorized during Homecoming weekend by a killer hell-bent on revenge.",Gifted Hands: The Ben Carson Story,Gifted Hands: The Ben Carson Story is a movie based on the life story of world-renowned neurosurgeon Ben Carson from 1961 to 1987.,Some Kind of Hate,"When troubled teen Lincoln is subjected to severe bullying, he accidentally conjures the vengeful ghost of Moira Karp. Once a teenage girl pushed to suicide, Moira is now an unstoppable force on a mission of gruesome retribution. But when she goes too far, Lincoln must prevent her from spiraling out of control.",,,,,,
1974-07-29 00:00:00,Josh Radnor,,1974,7,29,birthday,,Not Another Teen Movie,"On a bet, a gridiron hero at John Hughes High School sets out to turn a bespectacled plain Jane into a beautiful and popular prom queen in this outrageous send-up of the teen movies of the 1980s and '90s.",Happythankyoumoreplease,"Captures a generational moment - young people on the cusp of truly growing up, tiring of their reflexive cynicism, each in their own ways struggling to connect and define what it means to love and be loved. Six New Yorkers juggle love, friendship, and the keenly challenging specter of adulthood. Sam Wexler is a struggling writer who's having a particularly bad day. When a young boy gets separated from his family on the subway, Sam makes the questionable decision to bring the child back to his apartment and thus begins a rewarding, yet complicated, friendship. Sam's life revolves around his friends — Annie, whose self-image keeps her from commitment; Charlie and Mary Catherine, a couple whose possible move to Los Angeles tests their relationship; and Mississippi, a cabaret singer who catches Sam's eye.",The Galapagos Affair: Satan Came to Eden,"Darwin meets Hitchcock in this documentary. Directors Dan Geller and Dayna Goldfine have created a parable about the search for paradise, set in the brutal yet alluring landscape of the Galapagos Islands, which interweaves an unsolved 1930s murder mystery with stories of present day Galapagos pioneers. A gripping tale of idealistic dreams gone awry, featuring voice-over performances by Cate Blanchett, Diane Kruger, and Gustaf Skarsgard.",,,,,,
1935-07-29 00:00:00,Klaus Pagh,,1935,7,29,birthday,,The Misfit Brigade,"War story of the 27th Panzers, Hitler's heavy-duty combat regiment composed of prisoners.",,,,,,,,,,
