Date,Name,Country,Year,Month,Day,description,image,match_movie1,match_movie1_descr,match_movie2,match_movie2_descr,match_movie3,match_movie3_descr,match_book1,match_book1_descr,match_book2,match_book2_descr,match_book3,match_book3_descr
1014-07-29,Battle of Kleidion,,1014,7,29, Krum's campaigns Simeon I's campaigns Sviatoslav's invasion of Bulgaria Byzantine conquest of Bulgaria ,http://commons.wikimedia.org/wiki/Special:FilePath/The%20Chronicle%20of%20Ioannis%20Skylitzis%20Bulagar%20Defeat.jpg,Cliffs of Freedom,The timeless story of an ill-fated romance between a young Greek village girl and a conflicted Turkish officer during the dawn of the Greek War for Independence against the Ottoman Empire in 1821.,300: Rise of an Empire,"Greek general Themistocles attempts to unite all of Greece by leading the charge that will change the course of the war. Themistocles faces the massive invading Persian forces led by mortal-turned-god, Xerxes and Artemesia, the vengeful commander of the Persian navy.",God of Thunder,"Defeated on the battlefield by Thor, Loki is brought to Odin for justice. But by using his guile and trickery, Loki escapes to Earth. There he will conquer mankind and raise an even larger army to use in his quest for domination throughout the Nine Realms.  Enraged by devastation of his home, Thor pursues Loki, but in the journey, he is rendered defenseless, awakening on Earth without his mighty hammer, or his memory. Alone and disoriented, Thor is besieged by Loki’s followers, hell-bent on stopping him…at any cost. Enlisting the help of a female human companion, Thor fights his way North, in search of his mythical weapon. Finding his hammer, Thor’s identity and prowess are restored and he must now prepare himself for a final climactic battle with Loki, to prevent the overthrow of the universe.",Under the Yoke, The tranquility in a Bulgarian village under Ottoman rule is only superficial  the people are quietly preparing for an uprising  The plot follows the story of Boycho Ognyanov  who  having escaped from a prison in Diarbekir  returns to the Bulgarian town of Byala Cherkva  White Church  today Sopot  to take part in the rebellion  There he meets old friends  enemies  and the love of his life  The plot portrays the personal drama of the characters  their emotions  motives for taking part in or standing against the rebellion  betrayal and conflict  Historically  the uprising fails due to bad organization  limited resources  and betrayal  The way in which the Ottomans break the uprising down then becomes the pretext for the Russian Turkish war  that brought about Bulgarian independence  ,"The Enemy at the Gate: Habsburgs, Ottomans and the Battle for Europe", Major historian Andrew Wheatcroft reveals the full story behind four centuries of Ottoman incursions into the heartlands of Europe   In 1683  two empires   the Ottoman  based in Constantinople  and the Habsburg dynasty in Vienna   came face to face in the culmination of a 250 year old struggle for power at the Great Siege of Vienna  Within the city walls  the choice of resistance over surrender to the largest army ever assembled by the Turks created an all or nothing scenario  every last survivor would be enslaved or ruthlessly slaughtered    Although it was their most famous attack  the 1683 siege was the historical culmination of the Turks  sustained attempt to march westwards and finally obtain the city they had long called  The Golden Apple   Their defeat was to mark the beginning of the decline of the Ottoman Empire   With Turkey now seeking to re orient itself towards the West and with a new generation of politicians exploiting the residual tensions between East and West  The Enemy at the Gate provides a timely and masterful account of this most complex and epic of conflicts  ,"The Balkans: Nationalism, War and the Great Powers 1804 - 1999", This unique and lively history of Balkan geopolitics since the early nineteenth century gives readers the essential historical background to recent events in this war torn area  No other book covers the entire region  or offers such profound insights into the roots of Balkan violence  or explains so vividly the origins of modern Serbia  Croatia  Bosnia  Greece  Bulgaria  Romania  and Albania  Misha Glenny presents a lucid and fair minded account of each national group in the Balkans and its struggle for statehood  The narrative is studded with sharply observed portraits of kings  guerrillas  bandits  generals  and politicians  Glenny also explores the often catastrophic relationship between the Balkans and the Great Powers  raising some disturbing questions about Western intervention  
1030-07-29,Battle of Stiklestad,,1030,7,29,"The Battle of Stiklestad (Norwegian: Slaget på Stiklestad, Old Norse: Stiklarstaðir) in 1030 is one of the most famous battles in the history of Norway. In this battle, King Olaf II of Norway (Óláfr Haraldsson) was killed. During the pontificate of Pope Alexander III, the Roman Catholic Church declared Olaf a saint in 1164.[1] His younger half-brother, Harald Hardrada (Haraldr Haraldsson harðráði), was also present at the battle. Harald was only fifteen when the battle of Stiklestad took place. He became King of Norway in 1047, until his death in a failed invasion of England at the Battle of Stamford Bridge in 1066. The authenticity of the battle as a historical event is subject to question. Contemporary sources say the king was murdered. According to the Anglo Saxon Chronicle of 1030, Olaf was killed by his own people. Adam of Bremen wrote in 1070 that Olaf was killed in an ambush, and so did Florence of Worcester in 1100. Those are the only contemporary sources that mention the death of the king. After the king's canonization it was felt that the saint could not have died in such circumstances. The story of the Battle of Stiklestad as most know it gradually developed during the two centuries following the death of King Olaf. Since he was sainted, Olaf must have fallen in a major battle for Christianity.[2] During the 9th century, Norway was divided between several local kings controlling their own fiefs. By the end of the century, King Harald Fairhair (Old Norse: Haraldr Hárfagri) managed, mainly due to the military superiority gained by his marriage alliance with Hákon Grjótgarðsson of Nidaros, to subjugate these mini–kingdoms, and he created a unified Norwegian state. This alliance came apart after Harald's death. The jarls of Lade and various descendants of Harald Fairhair would spend the next century interlocked in feuds over power. As well as power politics, religion also played a part in these conflicts, as two of the descendants of Harald Fairhair, Haakon the Good and Olaf Tryggvason attempted to convert the then heathen Norwegians to Christianity. In the year 1000, Sveinn Hákonarson and Eiríkr Hákonarson (Old Norse: Eiríkr) of Lade took control over Norway, being supported by the Danish King Sveinn Forkbeard (Sveinn Haraldsson tjúguskegg). In 1015, Olaf Haraldsson, representing the descendants of Harald Fairhair, returned from one of his Viking trips and was immediately elected as King of Norway. In June 1016, he won the Battle of Nesjar against the jarls of Lade. ",http://commons.wikimedia.org/wiki/Special:FilePath/Fractal%20funny.jpg,Blood of Beasts,"Timeless tale of Beauty and the Beast set in the period of the Vikings. Freya, a warrior and the beautiful daughter of a Viking king, is held prisoner on an island castle by a Beast whom has been cursed by his god Odin.",The Book of Daniel,"Taken into slavery after the fall of Jerusalem in 605 B.C., Daniel is forced to serve the most powerful king in the world, King Nebuchadnezzar. Faced with imminent death, Daniel proves himself a trusted Advisor and is placed among the king's wise men. Threatened by death at every turn Daniel never ceases to serve the king until he is forced to choose between serving the king or honoring God. With his life at stake, Daniel has nothing but his faith to stand between him and the lions' den.",The Black Prince,"The Black Prince follows the story of the last Sikh Maharaja — the son of the powerful ruler Ranjit Singh — who was placed on the throne at the age of five, after the death of his father. In 1849, the young prince was removed from the throne and eventually sent off to England. His attempts to return to India and reclaim his kingdom were subsequently thwarted by the British.",King Harald's Saga, This compelling Icelandic history describes the life of King Harald Hardradi  from his battles across Europe and Russia to his final assault on England in 1066  less than three weeks before the invasion of William the Conqueror  It was a battle that led to his death and marked the end of an era in which Europe had been dominated by the threat of Scandinavian forces  Despite England s triumph  it also played a crucial part in fatally weakening the English army immediately prior to the Norman Conquest  changing the course of history  Taken from the Heimskringla   Snorri Sturluson s complete account of Norway from prehistoric times to 1177   this is a brilliantly human depiction of the turbulent life and savage death of the last great Norse warrior king  ,King Harald's saga: Harald Hardradi of Norway, This compelling Icelandic history describes the life of King Harald Hardradi  from his battles across Europe and Russia to his final assault on England in 1066  less than three weeks before the invasion of William the Conqueror  It was a battle that led to his death and marked the end of an era in which Europe had been dominated by the threat of Scandinavian forces  Despite England s triumph  it also played a crucial part in fatally weakening the English army immediately prior to the Norman Conquest  changing the course of history  Taken from the Heimskringla   Snorri Sturluson s complete account of Norway from prehistoric times to 1177   this is a brilliantly human depiction of the turbulent life and savage death of the last great Norse warrior king  ,The Burning Land,  At the end of the ninth century  with King Alfred of Wessex in ill health and his heir still an untested youth  it falls to Alfred s reluctant warlord Uhtred to outwit and outbattle the invading enemy Danes  led by the sword of savage warrior Harald Bloodhair  But the sweetness of Uhtred s victory is soured by tragedy  forcing him to break with the Saxon king  Joining the Vikings  allied with his old friend Ragnar and his old foe Haesten Uhtred devises a strategy to invade and conquer Wessex itself  But fate has very different plans     Bernard Cornwell s  The Burning Land  is a new chapter in his story of the birth of England and the legendary king who made it possible   
1209-07-29,massacre at Béziers,,1209,7,29,43°20′51″N 3°13′08″E﻿ / ﻿43.3476°N 3.2190°E﻿ / 43.3476; 3.2190 Languedoc War Languedoc Revolt Royal intervention and aftermath The Massacre at Béziers occurred on 22 July 1209 during the sack of Béziers by crusaders. It was the first major military action of the Albigensian Crusade.[dubious  – discuss] ,http://commons.wikimedia.org/wiki/Special:FilePath/Beziers%20Frankreich.jpg,The Charge of the Light Brigade,"A chronicle of events that led to the British involvement in the Crimean War against Russia and which led to the siege of Sevastopol and the fierce Battle of Balaclava on October 25, 1854 which climaxed with the heroic, but near-disastrous calvary charge made by the British Light Brigade against a Russian artillery battery in a small valley which resulted in the near-destruction of the brigade due to error of judgement and rash planning on part by the inept British commanders.",Braveheart,"Enraged at the slaughter of Murron, his new bride and childhood love, Scottish warrior William Wallace slays a platoon of the local English lord's soldiers. This leads the village to revolt and, eventually, the entire country to rise up against English rule.",Reign of Terror,"The French Revolution, 1794. The Marquis de Lafayette asks Charles D'Aubigny to infiltrate the Jacobin Party to overthrow Maximilian Robespierre, who, after gaining supreme power and establishing a reign of terror ruled by death, now intends to become the dictator of France.",Valentine's Rising, Returning to the Ozark Territories  freedom fighter David Valentine is shocked to find it overrun by vampiric Kurians under the command of the merciless Consul Solon  In a desperate gambit  Valentine leads a courageous group of soldiers on a mission to drive a spike into the gears of the Kurian Order  Valentine stakes life  honor  and the future of his home in a rebellion that sparks the greatest battle of his life  ,Can Rolant, On 15 August 778  Charlemagne s army was returning from a successful expedition against Saracen Spain when its rearguard was ambushed in a remote Pyrenean pass  Out of this skirmish arose a stirring tale of war  which was recorded in the oldest extant epic poem in French  The Song of Roland  written by an unknown poet  tells of Charlemagne s warrior nephew  Lord of the Breton Marches  who valiantly leads his men into battle against the Saracens  but dies in the massacre  defiant to the end  In majestic verses  the battle becomes a symbolic struggle between Christianity and Islam  while Roland s last stand is the ultimate expression of honour and feudal values of twelfth century France  ,The Song of Roland, On 15 August 778  Charlemagne s army was returning from a successful expedition against Saracen Spain when its rearguard was ambushed in a remote Pyrenean pass  Out of this skirmish arose a stirring tale of war  which was recorded in the oldest extant epic poem in French   The Song of Roland   written by an unknown poet  tells of Charlemagne s warrior nephew  Lord of the Breton Marches  who valiantly leads his men into battle against the Saracens  but dies in the massacre  defiant to the end  In majestic verses  the battle becomes a symbolic struggle between Christianity and Islam  while Roland s last stand is the ultimate expression of honour and feudal values of twelfth century France  
1210-07-29,Siege of Minerve,,1210,7,29,"Languedoc War Languedoc Revolt Royal intervention and aftermath The siege of Minerve was a military engagement which took place in June and July 1210 during the Albigensian Crusade in the town of Minerve in southern France. It was undertaken by the Catholic Crusaders against the Cathars in southern France, who were regarded as a heretical sect. The Crusaders, led by French nobleman Simon de Montfort, besieged and captured the town. The Crusaders allowed the soldiers defending the town, Catholics, and any Cathars who had not yet reached the status of perfect to go free. Three Cathar perfects who repented were pardoned, but 140 others who refused to do so were burnt at the stake. The Albigensian Crusade was initiated in the Kingdom of France at the behest of Pope Innocent III. Its purpose was to squash the growing Cathar movement, which flourished mainly in the Languedoc region of what later became Southern France.[1] The immediate cause was the killing of the papal legate, Pierre de Castelnau.[2] The Crusaders set out in the summer of 1209.[3] After several military victories, they were able to capture many towns without a fight.[4] After the fall of Carcassonne, papal legate Arnaud Amalric, who had led troops during the Massacre at Béziers, was replaced as commander of the Crusader force by Simon de Montfort, 5th Earl of Leicester, although Amalric continued to accompany the army.[5] ",http://commons.wikimedia.org/wiki/Special:FilePath/Minerve.jpg,Joan of Arc,"In the 15th Century, France is a defeated and ruined nation after the One Hundred Years War against England. The fourteen-year-old farm girl Joan of Arc claims to hear voices from Heaven asking her to lead God's Army against Orleans and crowning the weak Dauphin Charles VII as King of France. Joan gathers the people with her faith, forms an army, and conquers Orleans.",Henry V,"In the midst of the Hundred Years' War, the young King Henry V of England embarks on the conquest of France in 1415.",The Charge of the Light Brigade,"A chronicle of events that led to the British involvement in the Crimean War against Russia and which led to the siege of Sevastopol and the fierce Battle of Balaclava on October 25, 1854 which climaxed with the heroic, but near-disastrous calvary charge made by the British Light Brigade against a Russian artillery battery in a small valley which resulted in the near-destruction of the brigade due to error of judgement and rash planning on part by the inept British commanders.",The First Crusade: A New History, On the last Tuesday of November 1095  Pope Urban II delivered an electrifying speech that launched the First Crusade  His words set Christendom afire  Some 100 000 men  from knights to paupers  took up the call  the largest mobilization of manpower since the fall of the Roman Empire   Now  in  The First Crusade   Thomas Asbridge offers a gripping account of a titanic three year adventure filled with miraculous victories  greedy princes and barbarity on a vast scale  Readers follow the crusaders from their mobilization in Europe  where great waves of anti Semitism resulted in the deaths of thousands of Jews   to their arrival in Constantinople  an exotic  opulent city  ten times the size of any city in Europe  that bedazzled the Europeans  Featured in vivid detail are the siege of Nicaea and the pivotal battle for Antioch  the single most important military engagement of the entire expedition  where the crusaders  in desperate straits  routed a larger and better equipped Muslim army  Through all this  the crusaders were driven on by intense religious devotion  convinced that their struggle would earn them the reward of eternal paradise in Heaven  But when a hardened core finally reached Jerusalem in 1099 they unleashed an unholy wave of brutality  slaughtering thousands of Muslims  men  women  and children  all in the name of Christianity   The First Crusade marked a watershed in relations between Islam and the West  a conflict that set these two world religions on a course toward deep seated animosity and enduring enmity  The chilling reverberations of this earth shattering clash still echo in the world today   ,Can Rolant, On 15 August 778  Charlemagne s army was returning from a successful expedition against Saracen Spain when its rearguard was ambushed in a remote Pyrenean pass  Out of this skirmish arose a stirring tale of war  which was recorded in the oldest extant epic poem in French  The Song of Roland  written by an unknown poet  tells of Charlemagne s warrior nephew  Lord of the Breton Marches  who valiantly leads his men into battle against the Saracens  but dies in the massacre  defiant to the end  In majestic verses  the battle becomes a symbolic struggle between Christianity and Islam  while Roland s last stand is the ultimate expression of honour and feudal values of twelfth century France  ,The Song of Roland, On 15 August 778  Charlemagne s army was returning from a successful expedition against Saracen Spain when its rearguard was ambushed in a remote Pyrenean pass  Out of this skirmish arose a stirring tale of war  which was recorded in the oldest extant epic poem in French   The Song of Roland   written by an unknown poet  tells of Charlemagne s warrior nephew  Lord of the Breton Marches  who valiantly leads his men into battle against the Saracens  but dies in the massacre  defiant to the end  In majestic verses  the battle becomes a symbolic struggle between Christianity and Islam  while Roland s last stand is the ultimate expression of honour and feudal values of twelfth century France  
1545-07-29,Battle of the Solent,,1545,7,29," The naval Battle of the Solent took place on 18 and 19 July 1545 during the Italian Wars between the fleets of Francis I of France and Henry VIII of England, in the Solent, between Hampshire and the Isle of Wight. This was one of only two full-fledged naval battles fought by King Henry VIII's Tudor navy, along with the earlier Battle of Saint-Mathieu. The engagement was inconclusive, and is most notable for the sinking of the English carrack, Mary Rose. In 1545, France launched an invasion of England with 30,000 soldiers in more than 200 ships. Against this armada—larger than the Spanish Armada 43 years later—the English had about 12,000 soldiers and 80 ships. The French expedition started disastrously, the flagship Carraquon being destroyed on 6 July in an accidental fire whilst at anchor in the Seine. Admiral Claude d'Annebault transferred his flag to La Maistresse, which then ran aground as the fleet set sail. The leaks were patched up and the fleet crossed the Channel. The French entered the Solent and landed troops on the Isle of Wight.[2] On 18 July, the English came out of Portsmouth and engaged the French at long range, little damage being done on either side. La Maitresse was close to sinking due to her earlier damage but, although d'Annebault had to change his flagship again, she was saved. ",http://commons.wikimedia.org/wiki/Special:FilePath/Cowdray%20engraving-full-lowres.jpg,Sink the Bismarck!,"The story of the breakout of the German battleship Bismarck—accompanied by the heavy cruiser Prinz Eugen—during the early days of World War II. The Bismarck and her sister ship, Tirpitz, were the most powerful battleships in the European theater of World War II. The British Navy must find and destroy Bismarck before it can escape into the convoy lanes to inflict severe damage on the cargo shipping which was the lifeblood of the British Isles. With eight 15 inch guns, it was capable of destroying every ship in a convoy while remaining beyond the range of all Royal Navy warships.",The Battle of the River Plate,"In the early years of the World War II, the Royal Navy is fighting a desperate battle to keep the Atlantic convoy routes open to supply the British Isles, facing the great danger posed by the many German warships, such as the Admiral Graf Spee, which are scouring the ocean for cargo ships to sink.",We Dive at Dawn,"A gripping tale of WWII naval warfare in the Baltics, starring John Mills as Lt. Freddie Taylor, a British submarine Captain. The crew of the Sea Tiger are summoned from leave on shore with their families, and sent on a secret mission to intercept the Nazi battleship Brandenburg. In the ensuing battle the British submarine is damaged by a German destroyer. The submarine is leaking fuel so badly that the crew won't be able to make it back to Britain before running out somewhere along the Danish coast. When it seems that their only option may be to blow up the submarine and try to escape to Denmark, seaman James Hobson hatches a plan...",Sharpe's Trafalgar,  The year is 1805  and the  Calliope   with Richard Sharpe aboard  is captured by a formidable French warship  the  Revenant   which has been terrorizing British nautical traffic in the Indian Ocean  The French warship races toward the safety of its own fleet  carrying a stolen treaty that could provoke India into a new war against the British   and render for naught all that Sharpe has bravely fought for till now   But help comes from an unexpected quarter  An old friend  a captain in the Royal Navy  is on the trail of the  Revenant   and Sharpe comes aboard a 74 gun man of war called  Pucelle  in hot pursuit  What results is a breathtaking retelling of one of the most ferocious and one sided sea battles in European history  in which Nelson   and Sharpe   vanquish the combined naval might of France and Spain at Trafalgar   ,Trafalgar: The Biography Of A Battle, This is the true story of the Battle of Trafalgar  Britain s most significant sea battle  as seen through the smoke hazed gunports of the fighting ships  In an atmosphere of choking fumes from cannon and musket fire  amid noise so intense it was almost tangible  the crews of the British  French and Spanish ships did their best to carry out their allotted tasks  For over five hours they were in constant danger from a terrifying array of iron and lead missiles fired from enemy guns  as well as the deadly wooden splinters smashed from the ships  hulls by the cannon balls  While the men manoeuvred the ships and kept the cannons firing  the women helped the surgeons tend the sick or helped the boys   the  powder monkeys    in the hazardous job of carrying gunpowder cartridges from the central magazine to the gun decks  Trafalgar set the seal on British naval supremacy  which became the mainspring for the growth of the British Empire  and in the short term not only prevented Napoleon from invading Britain  but also enabled Britain and its Continental allies to mount the campaign that would eventually defeat the French Emperor  without Trafalgar there would be no Waterloo  ,The Ship,  One vital convoy can break Mussolini s stranglehold on Malta   but it is intercepted in the Mediterranean by enemy warships     Five light British cruisers are left to beat back the armed might of the Italian battle fleet and C S  Forester   creator of Horatio Hornblower   takes us aboard HMS Artemis as she steams into battle against overwhelming odds  We get inside the heads of Artemis s men  from the Captain on his bridge down to the lowest engine room rating  as they struggle over one long and terrifying afternoon to do their duty    C S  Forester brilliantly recounts life aboard a British warship during some of the darkest days of the Second World War  capturing the urgency of the blazing guns  the thunderous rupturing of deck plates  the screams of pain and the shouts of triumph   
