Date,Name,Country,Year,Month,Day,description,image,match_movie1,match_movie1_descr,match_movie2,match_movie2_descr,match_movie3,match_movie3_descr,match_book1,match_book1_descr,match_book2,match_book2_descr,match_book3,match_book3_descr
1911-07-29,First Universal Races Congress,,1911,7,29," The First Universal Races Congress met in 1911 for four days at the University of London as an early effort at anti-racism. Speakers from a number of countries discussed race relations and how to improve them.[1] The congress, with 2,100 attendees, was organised by prominent humanists of that era; it was conceived of a result of comments in 1906 by Felix Adler and primarily executed by Gustav Spiller, a leader in the British Ethical Union (now Humanists UK). Philip Stanhope was president of the congress, and William Pember Reeves chaired its executive committee.[2]  The call for the congress included these remarks:To discuss, in the light of science and modern conscience, the general relations subsisting between the peoples of the West and those of the East, between the so-called ""white"" and the so-called ""colored"" peoples, with a view to encouraging between them a fuller understanding, the most friendly feelings, and the heartier co-operation.… The interchange of material and other wealth between the races of mankind has of late years assumed such dimensions that the old attitude of distrust and aloofness is giving way to a genuine desire for a closer acquaintanceship. Out of this interesting situation has sprang the idea of holding a Congress where the representatives of the different races might meet each other face to face, and might, in friendly rivalry, further the cause of mutual trust and respect between the Occident and Orient, between the so-called ""white"" peoples and the so-called ""colored"" peoples.[3][4]More than 50 countries and 20 governments sent representatives, resulting in 58 papers which were categorized into five groups:[3] Resolutions resulting from the congress were:[3] ",http://commons.wikimedia.org/wiki/Special:FilePath/Universal%20Races%20Congress%20seated%20outside%20the%20entrance%20to%20the%20Imperial%20Institute%2C%20London%2C%201911.jpg,Uncle Tom,"In a collection of intimate interviews with some of America's most provocative black conservative thinkers, Uncle Tom takes a unique look at being black in America. Featuring media personalities, ministers, civil rights activists, veterans, and a self-employed plumber, the film explores their personal journeys of navigating the world as one of America's most misunderstood political and cultural groups: The American Black Conservative. In this eye-opening film from Director Justin Malone and Executive Producer Larry Elder, Uncle Tom examines self-empowerment, individualism and rejecting the victim narrative. Uncle Tom shows us a different perspective of American History from this often ignored and ridiculed group.",Once Brothers,"Drazen Petrovic and Vlade Divac were two friends who grew up together sharing the common bond of basketball. Together, they lifted the Yugoslavian National team to unimaginable heights. After conquering Europe, they both went to USA where they became the first two foreign players to attain NBA stardom. But with the fall of the Soviet Union on Christmas Day 1991, Yugoslavia split up. A war broke out between Petrovic's Croatia and Divac's Serbia. Long buried ethnic tensions surfaced. And these two men, once brothers, were now on opposite sides of a deadly civil war. As Petrovic and Divac continued to face each other on the basketball courts of the NBA, no words passed between the two. Then, on the fateful night of June 7, 1993, Drazen Petrovic was killed in an auto accident. This film will tell the gripping tale of these men, how circumstances beyond their control tore them apart, and whether Divac has ever come to terms with the death of a friend before they had a chance to reconcile.",The First Purge,"To push the crime rate below one percent for the rest of the year, the New Founding Fathers of America test a sociological theory that vents aggression for one night in one isolated community. But when the violence of oppressors meets the rage of the others, the contagion will explode from the trial-city borders and spread across the nation.",The Day of the Scorpion,  BOOK TWO OF THE RAJ QUARTET    India  August 9th 1942  The morning brings raids and the arrest by British police of Congress Party members  Amongst the prisoners is the distinguished ex Chief Minister Mohammed Ali Kasim  Loyal to the party s central vision of a unified free India  his incarceration is a symptom of the growing deterioration of Anglo Indian relations   For the long serving British family  the Laytons  the political and social ramifications are immediate  disturbing and tragic  Some  like Ronald Merrick  believe that true intimacy between the races is impossible  others  such as Sarah Layton  struggle to come to terms with their Anglo Indian past  With growing confusion and bewilderment  the British are forced to confront the violent and often brutal years that lie ahead of them  ,"Grand Expectations: The United States, 1945-1974", Beginning in 1945  America rocketed through a quarter century of extraordinary economic growth  experiencing an amazing boom that soared to unimaginable heights in the 1960s    At one point  in the late 1940s  American workers produced 57 percent of the planet s steel  62 percent of the oil  80 percent of the automobiles  The U S  then had three fourths of the world s gold supplies  English Prime Minister Edward Heath later said that the United States in the post War era enjoyed  the greatest prosperity the world has ever known   It was a boom that produced a national euphoria  a buoyant time of grand expectations and an unprecedented faith in our government  in our leaders  and in the American dream  an optimistic spirit which would be shaken by events in the  60s and  70s  and particularly by the Vietnam War   Now  in  Grand Expectations   James T  Patterson has written a highly readable and balanced work that weaves the major political  cultural  and economic events of the period into a superb portrait of America from 1945 through Watergate  Here is an era teeming with memorable events  from the bloody campaigns in Korea and the bitterness surrounding McCarthyism to the assassinations of the Kennedys and Martin Luther King  to the Vietnam War  Watergate  and Nixon s resignation  Patterson excels at portraying the amazing growth after World War II  the great building boom epitomized by Levittown  the largest such development in history  and the baby boom  which exploded literally nine months after V J Day   as well as the resultant buoyancy of spirit reflected in everything from streamlined toasters  to big  flashy cars  to the soaring  butterfly roof of TWA s airline terminal in New York  And he shows how this upbeat  can do mood spurred grander and grander expectations as the era progressed   Of course  not all Americans shared in this economic growth  and an important thread running through the book is an informed and gripping depiction of the civil rights movement  from the electrifying  Brown v  Board of Education  decision  to the violent confrontations in Little Rock  Birmingham  and Selma  to the landmark civil rights acts of 1964 and 1965  Patterson also shows how the Vietnam War  which provoked LBJ s growing credibility gap  vast defense spending that dangerously unsettled the economy  and increasingly angry protests  and a growing rights revolution  including demands by women  Hispanics  the poor  Native Americans  and gays  triggered a backlash that widened hidden rifts in our society  rifts that divided along racial  class  and generational lines  And by Nixon s resignation  we find a national mood in stark contrast to the grand expectations of ten years earlier  one in which faith in our leaders and in the attainability of the American dream was greatly shaken    The Oxford History of the United States  The Oxford History of the United States is the most respected multi volume history of our nation  The series includes three Pulitzer Prize winners  a  New York Times  bestseller  and winners of the Bancroft and Parkman Prizes   The Atlantic Monthly  has praised it as  the most distinguished series in American historical scholarship   a series that  synthesizes a generation s worth of historical inquiry and knowledge into one literally state of the art book     Conceived under the general editorship of C  Vann Woodward and Richard Hofstadter  and now under the editorship of David M  Kennedy  this renowned series blends social  political  economic  cultural  diplomatic  and military history into coherent and vividly written narrative   ,Black Mass: Apocalyptic Religion and the Death of Utopia, For the decade that followed the end of the cold war  the world was lulled into a sense that a consumerist  globalized  peaceful future beckoned  The beginning of the twenty first century has rudely disposed of such ideas  most obviously through 9 11and its aftermath  But just as damaging has been the rise in the West of a belief that a single model of political behaviour will become a worldwide norm and that  if necessary  it will be enforced at gunpoint    In  Black Mass   celebrated philosopher and critic John Gray explains how utopian ideals have taken on a dangerous significance in the hands of right wing conservatives and religious zealots  He charts the history of utopianism  from the Reformation through the French Revolution and into the present  And most urgently  he describes how utopian politics have moved from the extremes of the political spectrum into mainstream politics  dominating the administrations of both George W  Bush and Tony Blair  and indeed coming to define the political centre  Far from having shaken off discredited ideology  Gray suggests  we are more than ever in its clutches    Black Mass  is a truly frightening and challenging work by one of Britain s leading political thinkers  John Gray is the author of many critically acclaimed books  including  Straw Dogs  and  Al Qaeda and What It Means to Be Modern   A regular contributor to  The New York Review of Books   he is a professor of European thought at the London School of Economics  
1995-07-29,Operation Summer '95,,1995,7,29, 1992 1993 1994 1995 ,http://commons.wikimedia.org/wiki/Special:FilePath/Map%2057%20-%20Bosnia%20-%20Croatia%20-%20Livno%20Valley%2025-30%20July%201995.jpg,The Prince of Egypt: From Dream to Screen,The making of The Prince of Egypt (1998).,James Acaster: Cold Lasagne Hate Myself 1999,"On December 17th 2019, I, James Acaster, filmed my 2019 tour show Cold Lasagne Hate Myself 1999 at EartH in Hackney. It was a show about the best year of my life (1999) and the worst year of my life (2017), I wore a very nifty jacket for it and I looked extremely cool.",Through the Eyes of Forrest Gump,"A look behind the scenes of Robert Zemeckis' 1994 Oscar-winning film, 'Forrest Gump'.",Axiomatic,  Axiomatic  is a collection of Greg Egan s short stories that appeared in various science fiction magazines  mostly  Interzone  and  Asimov s   between 1989 and 1992    Contents  The Infinite Assassin  1991  The Hundred Light Year Diary  1992  Eugene  1990  The Caress  1990  Blood Sisters  1991  Axiomatic  1990  The Safe Deposit Box  1990  Seeing  1995  A Kidnapping  1995  Learning to Be Me  1990  The Moat  1991  The Walk  1992  The Cutie  1989  Into Darkness  1992  Appropriate Love  1991  The Moral Virologist  1990  Closer  1992  Unstable Orbits in the Space of Lies  1992  ,Literary theory: an introduction, Blackwell pbk 1992  ,Who Killed My Daughter?: The True Story of a Mother's Search for Her Daughter's Murderer, The best selling young adult novelist recounts her daughter s mysterious shooting death and her own investigation into the crime  including her use of psychics to contact her dead child and expose the truth    School Library Journal  Best Book of the Year   1992 The Literary Guild  alternate selection  1992 Time Life Digest selection  1992 ALA Best Book for Young Adults  1993 Library of Congress Selection as a Talking Book for the Blind  1993 N Y  Public Library    Books for the Teenage  selection  1993 Scholastic Book Club selection    March  1994  Feb   1999  Pacific Northwest Young Readers Award  1994 95 Nominated for Nevada Young Readers Award  1993 94 Nominated for Tennessee Volunteer State Young Readers Award  94 95 Nominated for Iowa Teen Award  1994 95 Foreign editions  Germany  Norway  Denmark  Poland  Sweden  
2009-07-29,2009 Burgos bombing,,2009,7,29,"A van bomb carrying more than 300 kg of explosive went off on 29 July 2009 outside a Civil Guard barracks in the northern city of Burgos, Spain, injuring at least 65 people. The attack was blamed on Basque separatist group Euskadi Ta Askatasuna (ETA).[1] Several children were among the 65 wounded in the attack. Some days before the attack, Spanish police warned that the organization might be trying a series of van bomb attacks[2] after they found information of three vans being carried to Spain in a document seized from arrested members Asier Borrero, Itziar Plaza and Iurgi Garitagoitia a few weeks before the attack.[3][4] About 120 people, one-third of them children, were sleeping in the building when the bomb went off at around 4:00 am local time (0200 UTC), blowing off most of its facade. The blast also left a two-metre (six-foot) deep crater in the street outside the barracks and heavily damaged the 14 storey residential complex and other buildings in the area.[5] The day after the bombing, a car bomb explosion on the island of Majorca killed two civil guards, Carlos Sáenz de Tejada García, 28, and Diego Salva Lezaun, 26. The two attacks came few hours before the 50th anniversary of the foundation of the organization. 42°21′23″N 3°41′36″W﻿ / ﻿42.35639°N 3.69333°W﻿ / 42.35639; -3.69333 ",http://commons.wikimedia.org/wiki/Special:FilePath/Atentado%20de%20Burgos%201.jpg,The Immortals,"An elaborate heist unites 8 strangers in a simultaneous assault on targets all over the city- and explodes in a hailstorm of gunfire and high-speed chases in this powerful action-thriller.  Recruited by a Mafia nightclub owner (Eric Roberts), 4 teams launch a brutal cross-town attack to retrieve suitcases full of cash.  But as the violence escalates, the team members discover just who their real target has been all along - and the shocking truth they have in common.",The Vault,"When an engineer learns of a mysterious, impenetrable fortress hidden under The Bank of Spain, he joins a crew of master thieves who plan to steal the legendary lost treasure locked inside while the whole country is distracted by Spain's World Cup Final. With thousands of soccer fans cheering in the streets, and security forces closing in, the crew have just minutes to pull off the score of a lifetime.",The Assignment,"Jack Shaw has experienced the terror first-hand. He's a top CIA agent who's tracked international killer-for-hire Carlos ""The Jackal"" Sanchez for over twenty years and barely survived Carlos' devastating bombing of a Parisian cafe. Now, he finally gets a break when he discovers Carlos' dead ringer: American naval officer and dedicated family man Annibal Ramirez.",Line of Duty, At the request of her many fans Terri Blackstock revisits the heroic cast of characters in this fifth book in her best selling Newpointe 911 series In Line of Duty  a bomb explodes at the Icon International building in New Orleans while lawyer Jill Clark Nichols is in the top floor boardroom  The thirty story building goes up in flames and fire departments from all around the area are called in  The firefighters from Newpointe are especially concerned since they know Jill is inside the building  Dan  her husband  rushes in to save her  But as firefighters work to evacuate the upper floors of the building  a second and third bomb explode  causing the lower floors to cave in  Firefighters and civilians are buried beneath the rubble  When the smoke finally clears  a count is taken  Jill narrowly escapes the chaos of the explosions and fire only to find Dan missing  Were the bombs the act of a terrorist  or a scheme coming from a heart of greed  Can Jill s faith carry her through these long days of pain and uncertainty  And will Dan survive this tragedy       or sacrifice his life in the line of duty  ,Captain Alatriste, It is the height of Spain s celebrated golden century   but beyond the walls of the Royal Palace there is little on the streets of Madrid that glitters  The Invincible Armada has been defeated  The shadow of the Inquisition looms large  And the Thirty Years  War rages on in Flanders  When a courageous soldier of this war  Captain Diego Alatriste  is forced to retire after being wounded in battle  he returns home to live the comparatively tame   though hardly quiet   life of a swordsman for hire  In this dangerous city where a thrust of steel settles all matters  there is no stronger blade than Alatriste s   The captain is approached with an offer of work that involves giving a scare to some strangers soon to arrive in Madrid  But on the night of the attack  it becomes clear that these aren t ordinary travelers   and that someone is out for their blood  What happens next is the first in a series of riveting twists  with implications that will reverberate throughout the courts of Europe ,The Machine-Gunners, With Nazi planes raining bombs on England night after night  every boy in Garmouth has a collection of shrapnel and other war souvenirs  But nothing comes close to the working machine gun Chas McGill pulls out of a downed bomber  While the police search frantically for the missing gun  Chas and his friends build a secret fortress to fight the Germans themselves  
,Independence Day,Peru,2023,7,29,"  An independence day is an annual event commemorating the anniversary of a nation's independence or statehood, usually after ceasing to be a group or part of another nation or state, or after the end of a military occupation, or after a major change in government. Many countries commemorate their independence from a colonial empire. Not all countries mark independence as a national holiday. Many, such as Australia, Canada, Denmark, New Zealand, Ireland, Luxembourg, Saudi Arabia, South Africa, Taiwan, and Turkey mark other dates of significance. The following is a list of independence days of countries around the world: ",,The Words That Built America,"In recognition of the 4th of July, several celebrities and politicians of differing ideologies join to read the historic documents which laid the foundation for the United States of America.",The Jayhawkers!,Before the U.S. Civil War rebel leader Luke Darcy sees himself as leader of a new independent Republic of Kansas but the military governor sends an ex-raider to capture Darcy.,Chinese Box,"The story of Hong Kong, from New Year's Day to June 30th, 1997, when the British left their colony and turned it over to the People's Republic of China.",Saratoga: Turning Point of America's Revolutionary War, In the summer of 1777  twelve months after the Declaration of Independence  the British launched an invasion from Canada under General John Burgoyne  It was the campaign that was supposed to the rebellion  but it resulted in a series of battles that changed America s history and that of the world  Stirring narrative history  skilfully told through the perspective of those who fought in the campaign  Saratoga brings to life as never before the inspiring story of Americans who did their utmost in what seemed a lost cause  achieving what proved to be the crucial victory of the Revolution    A New York Times Notable Book  1997  ,The Declaration of Independence & the Constituion of the United States, The two most treasured documents of American freedom together on one audiobook   We hold these truths to be self evident  that all men are created equal    Drafted by Thomas Jefferson in 1776 as an act of rebellion  The Declaration of Independence powerfully expresses the political principles of an emerging nation  As justification for severing ties with England  The Declaration presented a list of grievances against the King and declared the colonies to be sovereign states   We the People of the United States  in Order to form a more perfect Union  establish Justice  insure domestic Tranquility  provide for the common defence  promote the general Welfare  and secure the Blessings of Liberty to ourselves and our Posterity  do ordain and establish this Constitution for the United States of America  Ratified in 1788  The Constitution remains a shining example of patriotism and compromise  In outlining the power of the three branches of government and establishing the rights of all Americans  The Constitution united the 13 independent states and set forth the official viewpoint of a newly unified nation  Its most significant and insightful feature is that it can always be amended  ,The Jewel in the Crown, No set of novels so richly recreates the last days of India under British rule   two nations locked in an imperial embrace   as Paul Scott s historical tour de force    The Raj Quartet    The Jewel in the Crown  opens in 1942 as the British fear both Japanese invasion and Indian demands for independence  
1951-07-29 00:00:00,Gavan O'Herlihy,,1951,7,29,birthday,https://upload.wikimedia.org/wikipedia/commons/d/d5/Gavan_O%27Herlihy_%281974%29.jpg,The Last Outlaw,"The story follows a band of former Confederate soldiers who were part of a cavalry unit. Their commander, Graff (Rourke) had once been a heroic and staunch supporter of the southern cause, but after losing his family he became cold hearted and ruthless. His second in command is Eustis (Mulroney), whom Graff has trained on the strategies of leadership and combat command.",Willow,"The evil Queen Bavmorda hunts the newborn princess Elora Danan, a child prophesied to bring about her downfall. When the royal infant is found by Willow, a timid farmer and aspiring sorcerer, he's entrusted with delivering her from evil.",Death Wish 3,Architect/vigilante Paul Kersey arrives back in New York City and is forcibly recruited by a crooked police chief to fight street crime caused by a large gang terrorizing the neighborhoods.,,,,,,
1914-07-29 00:00:00,Alexander Gauge,,1914,7,29,birthday,https://upload.wikimedia.org/wikipedia/en/8/8b/Alexandergauge.jpg,The Iron Petticoat,"Captain Vinka Kovalenko defects from Russia, but not for political reasons. She defects because she feels discriminated against as a woman. Captain Chuck Lockwood gets the order to show her the bright side of capitalism, while she tries to convince him of the superiority of communism. Naturally, they fall in love, but there's still the KGB, which doesn't like the idea of having a defected Russian officer running around in London.",The Interrupted Journey,"When John North, a budding author, pulls the communication cord of a late night train that is taking him away on a weekend with his publishers wife, he sets in motion a series of events that lead to a train crash, a murder and a police man hunt, but all is not what it seems.",The Green Man,"Unknown to everyone but his shady Middle Eastern bosses, watchmaker Hawkins is actually a professional hired assassin with a predilection for killing his targets with bombs. After disposing of a dictator and millionaire, Hawkins is assigned to kill a politician who is heading to a remote hotel, The Green Man, for a secret tryst with his secretary. There, however, Hawkins' plot is discovered by vacuum salesman William Blake, who determines to stop him.",,,,,,
1906-07-29 00:00:00,Thelma Todd,,1906,7,29,birthday,https://upload.wikimedia.org/wikipedia/commons/thumb/6/63/Thelma_Todd_1933.jpg/220px-Thelma_Todd_1933.jpg,Horse Feathers,"Quincy Adams Wagstaff, the new president of Huxley U, hires bumblers Baravelli and Pinky to help his school win the big football game against rival Darwin U.",Speak Easily,A professor gets mixed up with chorus girls in a Broadway musical.,The Devil's Brother,"Two wannabe bandits join the service of a dashing nobleman, who secretly masquerades as Fra Diavolo, a notorious outlaw.",,,,,,
1972-07-29 00:00:00,Ato Essandoh,,1972,7,29,birthday,https://upload.wikimedia.org/wikipedia/commons/thumb/6/61/Ato_Essandoh_%2840194937141%29_%28cropped%29.jpg/220px-Ato_Essandoh_%2840194937141%29_%28cropped%29.jpg,Hitch,"Dating coach Alex 'Hitch' Hitchens mentors a bumbling client, Albert, who hopes to win the heart of the glamorous Allegra Cole. While Albert makes progress, Hitch faces his own romantic setbacks when proven techniques fail to work on Sara Melas, a tabloid reporter digging for dirt on Allegra Cole's love life. When Sara discovers Hitch's connection to Albert – now Allegra's boyfriend – it threatens to destroy both relationships.",Falling for Grace,"Grace is a Chinese American who longs to be a part of New York's high society. At a socialite event, she is mistaken for a Hong Kong heiress and meets her Prince Charming. Nothing is as it seems absorbing drama. What will happen to this Cinderella when the clock strikes midnight?",Get Him to the Greek,"Pinnacle records has the perfect plan to get their sinking company back on track: a comeback concert in LA featuring Aldous Snow, a fading rockstar who has dropped off the radar in recent years. Record company intern Aaron Green is faced with the monumental task of bringing his idol, out of control rock star Aldous Snow, back to LA for his comeback show.",,,,,,
